,Brand,Product,Price,Rating,Reviews
0,SHISEIDO,Ultimate Sun Protection Lotion WetForce Broad Spectrum Sunscreen SPF 50+,$40.00,15.8K loves,150 reviews
1,ST. TROPEZ,Self Tan Express Bronzing Mousse,$44.00,12.6K loves,288 reviews
2,COOLA,Full Spectrum 360° Sun Silk Drops Organic Sunscreen SPF 30,$46.00,29.4K loves,686 reviews
3,SEPHORA COLLECTION,Tinted Self-Tanning Body Mist,$19.00,21.9K loves,962 reviews
4,CLINIQUE,Moisture Surge CC Cream Hydrating Colour Corrector Broad Spectrum SPF 30,$39.50,29.5K loves,750 reviews
5,SUPERGOOP!,PLAY Everyday Lotion SPF 50 with Sunflower Extract,$22.00,1.5K loves,7 reviews
6,JACK BLACK,Intense Therapy Lip Balm SPF 25,$8.00,78.5K loves,3K reviews
7,LANCÔME,Rénergie Lift Multi-Action Ultra Dark Spot Correcting Cream SPF 30,$109.00,377 loves,288 reviews
8,JOSIE MARAN,Argan Daily Moisturizer SPF 47,$34.00,36.7K loves,1K reviews
9,ORIGINS,Dr. Andrew Weil For Origins™ Mega-Bright SPF 30 Skin Tone Correcting Oil-Free Moisturizer,$59.00,16.4K loves,182 reviews
10,JACK BLACK,Double-Duty Face Moisturizer Broad Spectrum SPF 20,$28.00,15.4K loves,366 reviews
11,ST. TROPEZ,Self Tan Purity Bronzing Water Face Mist,$30.00,9.5K loves,144 reviews
12,MURAD,Essential-C Day Moisture Broad Spectrum SPF 30 PA+++,$65.00,15.6K loves,404 reviews
13,DRUNK ELEPHANT,Umbra™ Sheer Physical Daily Defense Broad Spectrum Sunscreen SPF 30,$34.00,30.7K loves,1K reviews
14,BOBBI BROWN,BB Cream SPF 35,$48.00,30K loves,681 reviews
15,SUPERGOOP!,Invincible Setting Powder SPF 45,$30.00,23.4K loves,485 reviews
16,CLINIQUE,Acne Solutions™ BB Cream SPF 40,$39.50,38.2K loves,662 reviews
17,MURAD,Oil and Pore Control Mattifier Broad Spectrum SPF 45 PA++++,$42.00,5.6K loves,373 reviews
18,DR. JART+,Cicapair™ Tiger Grass Camo Drops SPF 44,$46.00,22.5K loves,286 reviews
19,TAN-LUXE,THE GRADUAL Illuminating Gradual Tan Lotion,$33.00,6.6K loves,43 reviews
20,LANCÔME,UV Expert Aquagel Defense Primer & Moisturizer SPF 50,$39.00,9.7K loves,855 reviews
21,DRUNK ELEPHANT,Umbra Tinte™ Physical Daily Defense Broad Spectrum Sunscreen SPF 30,$36.00,27.6K loves,534 reviews
22,MURAD,Invisiblur™ Perfecting Shield Broad Spectrum SPF 30 PA+++,$65.00,30.9K loves,720 reviews
23,ERBORIAN,CC Color Correcting & Redness Reducing Broad Spectrum SPF 25,$44.00,5.9K loves,54 reviews
24,TAN-LUXE,Super Glow Hyaluronic Self-Tan Serum,$49.00,6.4K loves,69 reviews
25,JOSIE MARAN,Argan Daily Moisturizer Tinted SPF 47 Protect + Perfect,$36.00,12.2K loves,383 reviews
26,TAN-LUXE,THE BUTTER Illuminating Tanning Butter,$36.00,6.8K loves,90 reviews
27,ORIGINS,Plantscription™ SPF 25 Power Anti-Aging Cream,$62.00,6.8K loves,42 reviews
28,DR. JART+,Black Label Detox BB Beauty Balm,$36.00,25.4K loves,1K reviews
29,PHILOSOPHY,Renewed Hope in A Jar SPF 30 Moisturizer,$39.00,5.3K loves,105 reviews
30,PERRICONE MD,Vitamin C Ester Photo-Brightening Moisturizer SPF 30,$69.00,14.2K loves,602 reviews
31,ISLE OF PARADISE,"Glow Clear, Color Correcting Self-Tanning Mousse",$29.00,7.7K loves,118 reviews
32,MURAD,Anti-Aging Moisturizer SPF 30 PA+++,$50.00,9.5K loves,109 reviews
33,ALGENIST,SUBLIME DEFENSE Ultra Lightweight UV Defense Fluid SPF 50,$28.00,20.4K loves,417 reviews
34,TAN-LUXE,THE WATER Hydrating Self-Tan Water,$47.00,4.3K loves,50 reviews
35,DR. DENNIS GROSS SKINCARE,Alpha Beta® Intense Glow Pad Self-Tanner for Face,$38.00,11.8K loves,552 reviews
36,CLARINS,Sunscreen Multi-Protection Broad Spectrum SPF 50,$43.00,6.6K loves,106 reviews
37,PERRICONE MD,High Potency Classics: Face Finishing & Firming Moisturizer Tint SPF 30,$69.00,4.5K loves,296 reviews
38,CLINIQUE,Even Better Skin Tone Correcting Moisturizer Broad Spectrum SPF 20,$50.00,12K loves,402 reviews
39,COOLA,Mineral Face Matte Tint Sunscreen Moisturizer SPF 30,$36.00,15.1K loves,203 reviews
40,SEPHORA FAVORITES,Sun Safety Kit,"$39.00
($114.00 value)",23.9K loves,176 reviews
41,SUPERGOOP!,Zincscreen 100% Mineral Lotion SPF 40 PA+++,$42.00,9.9K loves,213 reviews
42,KIEHL'S SINCE 1851,Super Fluid Daily UV Defense Sunscreen Broad Spectrum SPF 50+,$61.00,11.3K loves,62 reviews
43,SUPERGOOP!,Handscreen SPF 40,$38.00,1.4K loves,153 reviews
44,LANCÔME,Bienfait Multi-Vital Sunscreen Lotion Broad Spectrum SPF 30,$50.00,3.9K loves,135 reviews
45,CLINIQUE,Superdefense SPF 20 Daily Defense Moisturizer Very Dry to Dry Combination,$48.00,5.3K loves,262 reviews
46,ST. TROPEZ,Tan Applicator Mitt,$6.50,26.1K loves,698 reviews
47,KIEHL'S SINCE 1851,Ultra Facial Cream SPF 30,$32.00,12.4K loves,91 reviews
48,ESTÉE LAUDER,Advanced Time Zone SPF 15- Normal/Combination Skin,$78.00,1.2K loves,11 reviews
49,BIOSSANCE,Squalane + Mineral SPF 45,$39.00,6.4K loves,87 reviews
50,SHISEIDO,Urban Environment Tinted UV Protector Broad Spectrum SPF 43,$35.00,18K loves,315 reviews
51,JOSIE MARAN,Argan Liquid Gold Self-Tanning Oil,$39.00,19.4K loves,625 reviews
52,VOLITION BEAUTY,Prismatic Luminizing Shield SPF 50,$35.00,16.2K loves,256 reviews
53,IT COSMETICS,Anti-Aging Armour Tinted Sunscreen SPF 50+,$38.00,13.3K loves,137 reviews
54,SHISEIDO,Future Solution LX Total Protective Cream Broad Spectrum SPF 20 Sunscreen,$265.00,752 loves,2 reviews
55,TARTE,Brazilliance™ PLUS+ Self-Tanner + Mitt,$39.00,18K loves,409 reviews
56,COOLA,Rōsilliance™ Organic BB+ Cream SPF 30,$52.00,11K loves,181 reviews
57,SHISEIDO,Ultimate Sun Protection Lotion WetForce Broad Spectrum Sunscreen SPF 50+ Mini,$22.00,0 loves,2 reviews
58,COOLA,Sunless Tan Firming Lotion,$46.00,3.4K loves,18 reviews
59,KIEHL'S SINCE 1851,Ultra Facial Moisturizer SPF 30,$32.00,5.4K loves,37 reviews
60,SUPERGOOP!,Glow Stick SPF 50,$25.00,19.6K loves,225 reviews
61,COOLA,Organic Sunless Tan Anti-Aging Face Serum,$54.00,13.3K loves,124 reviews
62,CLINIQUE,Pep-Start Daily UV Protector Broad Spectrum SPF 50,$19.50,15K loves,272 reviews
63,MURAD,Perfecting Day Cream Broad Spectrum SPF 30 PA+++,$58.00,5.7K loves,165 reviews
64,ORIGINS,Plantscription™ SPF 25 Power Anti-Aging Oil-Free Cream,$62.00,4.9K loves,31 reviews
65,SUPERGOOP!,Defense Refresh (Re)setting Mist SPF 40,$30.00,1.2K loves,7 reviews
66,SUPERGOOP!,City Sunscreen Serum SPF 30,$42.00,10.9K loves,287 reviews
67,CLARINS,Radiance-Plus Golden Glow Booster,$32.00,11.6K loves,334 reviews
68,SUPERGOOP!,Glow Oil SPF 50,$34.00,1.9K loves,269 reviews
69,NARS,Radiance Primer Broad Spectrum SPF 35 Sunscreen,$36.00,9.7K loves,68 reviews
70,SHISEIDO,Clear Stick UV Protector WetForce Broad Spectrum Sunscreen SPF 50+,$28.00,7.5K loves,77 reviews
71,PHILOSOPHY,Ultimate Miracle Worker Multi-Rejuvenating Cream SPF 30,$75.00,7.6K loves,99 reviews
72,CLINIQUE,Smart Broad Spectrum SPF 15 Custom-Repair Moisturizer for Dry Combination Skin,$55.00,2K loves,29 reviews
73,COOLA,Makeup Setting Spray Organic Sunscreen SPF 30,$36.00,21.1K loves,488 reviews
74,ST. TROPEZ,Self Tan Dark Bronzing Mousse,$44.00,5.8K loves,181 reviews
75,DIOR,Capture Dreamskin Fresh & Perfect Cushion Broad Spectrum SPF 50,$82.00,9.9K loves,139 reviews
76,DR. DENNIS GROSS SKINCARE,Dark Spot Sun Defense Broad Spectrum SPF 50,$42.00,6K loves,107 reviews
77,CLINIQUE,Repairwear Laser Focus Line Smoothing Cream Broad Spectrum SPF 15 for Very Dry to Dry Combination Skin,$51.00,1K loves,7 reviews
78,COOLA,Classic Face SPF 30 - Cucumber,$32.00,4K loves,53 reviews
79,DR. DENNIS GROSS SKINCARE,Alpha Beta® Glow Pad™ For Body With Active Vitamin D,$45.00,3.8K loves,105 reviews
80,CLINIQUE,Super City Block Oil-Free Daily Face Protector Broad Spectrum 40 SPF,$26.50,12K loves,784 reviews
81,SHISEIDO,Ultimate Sun Protection Cream WetForce Broad Spectrum Face Sunscreen SPF 50+,$36.00,7.4K loves,104 reviews
82,MDSOLARSCIENCES,Mineral Crème Broad Spectrum SPF 50 UVA-UVB Sunscreen,$30.00,11.4K loves,358 reviews
83,ALGENIST,Repairing Tint & Radiance Moisturizer SPF 30,$42.00,4K loves,108 reviews
84,SUPERGOOP!,Forever Young Body Butter with Sea Buckthorn SPF 40 PA+++,$38.00,8.9K loves,55 reviews
85,ST. TROPEZ,Self Tan Extra Dark Bronzing Mousse,$45.00,3.6K loves,84 reviews
86,DERMALOGICA,Prisma Protect SPF 30 Moisturizer,$65.00,2.8K loves,116 reviews
87,ST. TROPEZ,Gradual Tan Watermelon Infusion Body Lotion,$25.00,5.4K loves,692 reviews
88,SUPERGOOP!,AcaiFusion Lip Balm Broad Spectrum SPF 30,$9.50,16.5K loves,148 reviews
89,SHISEIDO,WASO: Color-Smart Day Moisturizer SPF 30 Sunscreen,$38.00,4.7K loves,46 reviews
90,PETER THOMAS ROTH,Max Mineral Naked Broad Spectrum SPF 45,$38.00,7.5K loves,90 reviews
91,KIEHL'S SINCE 1851,Powerful Wrinkle Reducing Cream Sunscreen Broad Spectrum SPF 30,$76.00,1.6K loves,9 reviews
92,CLINIQUE,Broad Spectrum SPF 50 Mineral Sunscreen Fluid for Face,$28.50,4.3K loves,43 reviews
93,SUPERGOOP!,PLAY Everyday Lotion SPF 30 with Sunflower Extract,$32.00,470 loves,10 reviews
94,SMASHBOX,Photo Finish Foundation Primer SPF 20,$42.00,10.8K loves,467 reviews
95,NATURALLY SERIOUS,Mineral Sun Defense Moisturizer Broad Spectrum Sunscreen SPF 30,$34.00,2.5K loves,23 reviews
96,LANCÔME,Rénergie Lift Multi-Action Day Cream with SPF 15 - All Skin Types,$99.00,2.1K loves,29 reviews
97,SHISEIDO,White Lucent Day Emulsion Broad Spectrum SPF 23,$70.00,1.2K loves,5 reviews
98,ST. TROPEZ,Gradual Tan Classic Everyday Body Lotion,$25.00,6.4K loves,117 reviews
99,CLARINS,Multi-Active Day Cream SPF 20 - All Skin Types,$55.00,2.9K loves,65 reviews
100,COOLA,Daydream™ Mineral Primer SPF 30,$42.00,8.2K loves,133 reviews
101,FRESH,Sugar Sport Treatment Sunscreen SPF 30,$25.00,9.6K loves,100 reviews
102,CLINIQUE,Broad Spectrum SPF 50 Sunscreen Face Cream,$27.00,9.3K loves,202 reviews
103,KIEHL'S SINCE 1851,Super Multi-Corrective Cream Sunscreen Broad Spectrum SPF 30,$85.00,1.4K loves,7 reviews
104,PERRICONE MD,No Makeup Lipstick Broad Spectrum SPF 15,$30.00,12.3K loves,646 reviews
105,PETER THOMAS ROTH,Max Sheer All Day Moisture Defense Lotion SPF 30 Sunscreen Lotion,$42.00,7.2K loves,510 reviews
106,JOSIE MARAN,Juicy Mango Argan Liquid Gold Self-Tanning Body Oil,$39.00,0 loves,21 reviews
107,CLINIQUE,Sun-Kissed Face Gelee Complexion Multitasker,$29.50,8.8K loves,44 reviews
108,COOLA,Sport Continuous Spray SPF 30 - Tropical Coconut,$36.00,8.9K loves,119 reviews
109,SHISEIDO,Urban Environment UV Protection Cream Broad Spectrum SPF 40 For Face/Body,$35.00,7.5K loves,196 reviews
110,SUPERGOOP!,PLAY Antioxidant Mist SPF 50 with Vitamin C,$21.00,752 loves,199 reviews
111,ST. TROPEZ,Self Tan Express Starter Kit,"$27.00
($42.50 value)",5.1K loves,35 reviews
112,ISLE OF PARADISE,Express Ultra Dark Mousse,$29.00,2.8K loves,37 reviews
113,CLARINS,Liquid Bronze Self Tanning,$40.00,4.5K loves,227 reviews
114,CLARINS,Sunscreen Care Oil Spray Broad Spectrum SPF 30,$36.00,4.6K loves,40 reviews
115,MARIO BADESCU,Oil Free Moisturizer Broad Spectrum SPF 30,$28.00,2.8K loves,14 reviews
116,SHISEIDO,Ultimate Sun Protection Lotion Broad Spectrum SPF 50+ WetForce for Sensitive Skin & Children,$42.00,7.4K loves,153 reviews
117,KIEHL'S SINCE 1851,Facial Fuel Sunscreen Broad Spectrum SPF 20,$35.00,520 loves,4 reviews
118,DERMALOGICA,Clearing Defense SPF 30 Moisturizer,$28.00,1.7K loves,275 reviews
119,DR. DENNIS GROSS SKINCARE,Instant Radiance Sun Defense Sunscreen Broad Spectrum SPF 40,$42.00,3.8K loves,51 reviews
120,PETER THOMAS ROTH,Instant Mineral SPF 45,$30.00,13.2K loves,473 reviews
121,SOL DE JANEIRO,Bum Bum Sol Oil SPF 30,$38.00,12.5K loves,107 reviews
122,TAN-LUXE,HYDRA MOUSSE Hydrating Self-Tan Mousse,$49.00,2.8K loves,45 reviews
123,ST. TROPEZ,Gradual Tan Everyday Tinted Body Lotion,$30.00,5.3K loves,103 reviews
124,CLINIQUE,City Block Sheer Oil-Free Daily Face Protector SPF 25,$27.00,6.2K loves,470 reviews
125,KATE SOMERVILLE,UncompliKated SPF 50 Soft Focus Makeup Setting Spray,$38.00,10.4K loves,178 reviews
126,CLINIQUE,Superdefense SPF 20 Daily Defense Moisturizer Combination Oily to Oily,$48.00,2.5K loves,174 reviews
127,SUPERGOOP!,Shine On Lip Screen Broad Spectrum SPF 50,$22.00,6.8K loves,59 reviews
128,DIOR,Capture Dreamskin Fresh & Perfect Cushion Broad Spectrum SPF 50 Refill,$42.00,4.6K loves,23 reviews
129,SOL DE JANEIRO,My Sol Stick SPF 50,$26.00,7.2K loves,57 reviews
130,AMOREPACIFIC,Natural Protector Broad Spectrum SPF 35 Sunscreen,$65.00,2.1K loves,18 reviews
131,CLINIQUE,Repairwear Uplifting Firming Cream Broad Spectrum SPF 15,$66.00,797 loves,13 reviews
132,SUPERGOOP!,Poof 100% Mineral Part and Scalp Powder SPF 45,$34.00,4.1K loves,34 reviews
133,ST. TROPEZ,Self Tan Purity Bronzing Water Mousse,$42.00,5.3K loves,126 reviews
134,COOLA,Liplux SPF 30,$12.00,7K loves,48 reviews
135,ST. TROPEZ,Gradual Tan Plus Luminous Veil Everyday Illuminating Face Cream,$30.00,1.1K loves,9 reviews
136,CLARINS,Self Tanning Milky-Lotion,$40.00,2.2K loves,33 reviews
137,COOLA,Sunless Tan Luminizing Face Compact,$42.00,1.9K loves,9 reviews
138,TOM FORD,Face Protect SPF 50,$76.00,3.2K loves,21 reviews
139,SEPHORA COLLECTION,8 HR Mattifying Moisturizer Sunscreen Broad Spectrum SPF20,$23.00 $17.00,10.1K loves,540 reviews
140,COOLA,Mineral Body Sunscreen SPF 50,$36.00,1.9K loves,204 reviews
141,CLARINS,Self Tanning Instant Gel,$40.00,6.2K loves,834 reviews
142,TAN-LUXE,Wonder Oil Illuminating Self-Tan Oil,$68.00,2.1K loves,13 reviews
143,COOLA,Sunless Tan Express Sculpting Mousse,$48.00,2.5K loves,23 reviews
144,COOLA,ER+ Radical Recovery After-Sun Lotion,$32.00,6.4K loves,60 reviews
145,ESTÉE LAUDER,"DayWear Advanced Multi-Protection Anti-Oxidant Creme, Normal/Combination",$54.00,3.5K loves,46 reviews
146,ST. TROPEZ,In Shower Gradual Tan,$25.00,13.8K loves,601 reviews
147,COOLA,Mineral Body Sunscreen SPF 30,$36.00,1.1K loves,194 reviews
148,COOLA,Mineral Sun Silk Crème SPF 30,$42.00,5.6K loves,60 reviews
149,KIEHL'S SINCE 1851,Super Fluid UV Mineral Defense Titanium Dioxide Sunscreen Broad Spectrum SPF 50+,$38.00,2.7K loves,20 reviews
150,CLINIQUE,Age Defense BB Cream Broad Spectrum SPF 30,$39.50,11.9K loves,756 reviews
151,DR. DENNIS GROSS SKINCARE,Sheer Mineral Sun Spray SPF 50,$42.00,8K loves,62 reviews
152,SHISEIDO,Future Solution LX Universal Defense Broad Spectrum SPF 50+,$100.00,49 loves,0 reviews
153,LANCÔME,Rènergie Lift Multi-Action Rich Cream with SPF 15 For Dry Skin,$99.00,660 loves,7 reviews
154,CLINIQUE,Smart Broad Spectrum SPF 15 Custom-Repair Moisturizer for Very Dry to Dry Skin,$55.00,755 loves,5 reviews
155,ISLE OF PARADISE,Prep It Self-Tan Priming Spray,$22.00,5.1K loves,22 reviews
156,SUPERGOOP!,Super Power Sunscreen Mousse Broad Spectrum SPF 50,$19.00,9.3K loves,147 reviews
157,COOLA,Sunless Tan Dry Body Oil Mist,$46.00,8.8K loves,85 reviews
158,JOSIE MARAN,Whipped Argan Oil SPF 45 Body Butter,$42.00,1.3K loves,20 reviews
159,COOLA,Mineral Sunscreen Spray SPF 30,$42.00,1.4K loves,29 reviews
160,ST. TROPEZ,Gradual Tan Classic Everyday Mousse,$25.00,2.6K loves,23 reviews
161,SHISEIDO,Future Solution LX Total Protective Emulsion Broad Spectrum SPF 20 Sunscreen,$265.00,182 loves,1 review
162,CLARINS,Delicious Self-Tanning Cream,$48.00,1.6K loves,249 reviews
163,ST. TROPEZ,Self Tan Classic Bronzing Lotion,$42.00,1K loves,21 reviews
164,ST. TROPEZ,Gradual Tan Everyday Pre-Shower Tanning Mousse,$20.00,1.9K loves,26 reviews
165,ST. TROPEZ,Self Tan Purity Water Gel,$44.00,1.1K loves,34 reviews
166,SUPERGOOP!,PLAY 100% Mineral Broad Spectrum Lotion SPF 50,$36.00,2.7K loves,20 reviews
167,JACK BLACK,Oil-Free Sun Guard Sunscreen Water Resistant SPF 45,$21.00,5.5K loves,72 reviews
168,CLINIQUE,Non-Streak Bronzer,$21.00,938 loves,52 reviews
169,COOLA,Sunless Tan Luminizing Body Serum,$48.00,1.3K loves,8 reviews
170,KORRES,Greek Yoghurt After Sun Cooling Gel,$26.00,11.3K loves,342 reviews
171,TARTE,Glow with the Faux Foaming Self-Tanner with Mitt,$39.00,8.5K loves,178 reviews
172,CHARLOTTE TILBURY,Overnight Bronze and Glow Mask,$55.00,1.4K loves,8 reviews
173,ST. TROPEZ,One Night Only Wash Off Face and Body Lotion,$18.00,4.7K loves,86 reviews
174,SOBEL SKIN RX,Plant Stem Cell Day Cream SPF 30,$75.00,154 loves,1 review
175,TAN-LUXE,SLEEP OIL Rejuvenating Miracle Tanning Oil,$49.00,3.5K loves,19 reviews
176,TAN-LUXE,Instant Hero Skin Perfector,$33.00,1.4K loves,2 reviews
177,OUAI,After Sun Body Soother,$25.00,3.1K loves,50 reviews
178,TARTE,Tarteguard 30 Vegan Sunscreen Lotion Broad Spectrum SPF 30,$32.00,27.9K loves,586 reviews
179,LANCER,Sheer Fluid Sun Shield Broad Spectrum SPF 30 Sunscreen,$60.00,2.8K loves,27 reviews
180,SMASHBOX,Camera Ready CC Cream Broad Spectrum SPF 30 Dark Spot Correcting,$42.00,29.6K loves,1K reviews
181,CLINIQUE,Self Sun Body Tinted Lotion,$29.00,2.3K loves,163 reviews
182,CLINIQUE,Repairwear Laser Focus Line Smoothing Cream Broad Spectrum SPF 15 for Combination Oily to Oily Skin,$51.00,507 loves,3 reviews
183,ST. TROPEZ,Gradual Tan Plus Sculpt and Glow Everyday Multi-Active Toning Lotion,$35.00,1.9K loves,20 reviews
184,SUPERGOOP!,Healthy Glow Sunless Tan Broad Spectrum Suncreen SPF 40,$38.00,2.4K loves,20 reviews
185,MOROCCANOIL,Sun Oil 15 SPF,$32.00,2.2K loves,16 reviews
186,ST. TROPEZ,Self Tan Dark Bronzing Mist,$40.00,547 loves,15 reviews
187,ANTHONY,Day Cream Broad Spectrum Sunscreen SPF 30,$34.00,598 loves,7 reviews
188,MURAD,Resurgence® Age–Balancing Moisture Broad Spectrum SPF 30,$74.00,2K loves,31 reviews
189,SHISEIDO,Ultimate Sun Protection Spray Broad Spectrum SPF 50+ For Face/Body,$40.00,12.4K loves,117 reviews
190,SUPERGOOP!,PLAY 100% Mineral Mist SPF 30 with Marigold Extract,$34.00,3.1K loves,17 reviews
191,MOROCCANOIL,After-Sun Milk Soothing Body Lotion,$28.00,3.2K loves,9 reviews
192,CLINIQUE,Broad Spectrum SPF 30 Mineral Sunscreen Lotion for Body,$32.00,2K loves,18 reviews
193,ESTÉE LAUDER,DayWear Multi-Protection Anti-Oxidant Sheer Tint Release Moisturizer Broad Spectrum SPF 15 - Normal/ Combination Skin,$54.00,2.9K loves,19 reviews
194,ST. TROPEZ,Self Tan Classic Bronzing Mist,$35.00,1.4K loves,16 reviews
195,ISLE OF PARADISE,Disco Tan Instant Wash-Off Body Bronzer,$22.00,2K loves,17 reviews
196,KOPARI,Sundaze Mineral Face Sunscreen SPF 30,$34.00,1.8K loves,17 reviews
197,NARS,Monoi Body Glow I,$59.00,16.1K loves,168 reviews
198,ST. TROPEZ,One Night Only Finishing Body Gloss,$25.00,2.5K loves,33 reviews
199,MOROCCANOIL,Sun Lotion 50 SPF,$32.00,1.4K loves,10 reviews
200,TARTE,Tarteguard Mineral Powder Sunscreen Broad Spectrum SPF 30,$28.00,23.5K loves,201 reviews
201,DERMADOCTOR,Photo Dynamic Therapy® 3–in–1 Facial Lotion With Broad Spectrum SPF 30,$85.00,1.6K loves,143 reviews
202,TAN-LUXE,Glyco Water Self-Tan Eraser,$33.00,654 loves,3 reviews
203,DERMADOCTOR,DD Cream Dermatologically Defining BB Cream Broad Spectrum SPF 30,$40.00,4.3K loves,283 reviews
204,ALGENIST,ALIVE Prebiotic Balancing Moisturizer SPF 15,$40.00,1K loves,15 reviews
205,MOROCCANOIL,Sun Lotion 30 SPF,$32.00,983 loves,6 reviews
206,COOLA,Classic Body SPF 50- Guava Mango,$32.00,1.4K loves,12 reviews
207,MURAD,City Skin Age Defense Broad Spectrum SPF 50 PA++++,$68.00,14.9K loves,230 reviews
208,ST. TROPEZ,Self Tan Bronzing Mousse,$19.00,12K loves,1K reviews
209,COOLA,Sport Continuous Spray SPF 50 - Unscented,$36.00,4.2K loves,68 reviews
210,LANCÔME,Bienfait Teinté Beauty Balm Sunscreen Broad Spectrum SPF 30,$47.00,9.3K loves,97 reviews
211,CLARINS,UV PLUS Anti-Pollution Sunscreen Multi-Protection Tint SPF 50,$45.00,5.6K loves,59 reviews
212,KATE SOMERVILLE,Daily Deflector™ Waterlight Broad Spectrum SPF 50+ PA+++ Anti-Aging Sunscreen,$48.00,3.4K loves,71 reviews
213,FRESH,Black Tea Age-Delay Lotion Broad Spectrum Sunscreen SPF 20,$70.00,2.7K loves,63 reviews
214,COOLA,Mineral Face Organic Matte Tint Sunscreen Lotion SPF 30,$36.00,18 loves,0 reviews
